### ISSUE TITLE
Dockerized Pihole v6 not resolving DNS requests on host interface (via docker interface works)

### ISSUE THREAD

**Issue by aronmgv** [pi-hole/docker-pi-hole#1735]
Hi,

## Details
After updating to V6 pihole stopped answering DNS requests on host interface e.g.: `192.168.255.12`, but answers them on docker interface IP e.g.: `172.31.1.102`..

First thing I tried was clearing iptables, so there are no rules whatsoever, then it worked on host IP.. 

Next thing was a tcpdump on udp/53 within container, could see the requests coming into container, but on the client it was "timing out":

linux client:
```
nslookup dsl.sk 192.168.255.12
;; communications error to 192.168.255.12#53: timed out
;; communications error to 192.168.255.12#53: timed out
;; communications error to 192.168.255.12#53: timed out
;; no servers could be reached
```

pihole container:
```
pihole:/# tcpdump -n udp port 53 | grep dsl.sk
tcpdump: verbose output suppressed, use -v[v]... for full protocol decode
listening on eth0, link-type EN10MB (Ethernet), snapshot length 262144 bytes
14:51:35.500250 IP 192.168.255.11.34741 > 172.31.1.102.53: 5570+ A? dsl.sk. (24)
14:51:40.504810 IP 192.168.255.11.48444 > 172.31.1.102.53: 5570+ A? dsl.sk. (24)
14:51:45.508777 IP 192.168.255.11.42984 > 172.31.1.102.53: 5570+ A? dsl.sk. (24)

```

There were no entries in the query log..

Lastly I tried downgrading to the `2024.01.0` version and everything works flawlessly.. 

## Environment

Docker Tag 2025.02.3
Core v6.0.3
FTL v6.0.1
Web interface v6.0.1

Docker version 28.0.0, build f9ced58
Linux edoras 6.1.0-30-amd64 #1 SMP PREEMPT_DYNAMIC Debian 6.1.124-1 (2025-01-12) x86_64 GNU/Linux

## Related Issues
- [x] I have searched this repository/Pi-hole forums for existing issues and pull requests that look similar 

## How to reproduce the issue 

1. Environment data
  * see above
2. docker-compose.yml: reproducible with example: https://github.com/pi-hole/docker-pi-hole?tab=readme-ov-file#quick-start

## These common fixes didn't work for my issue

- [x] I have tried removing/destroying my container, and re-creating a new container
- [x] I have tried fresh volume data by backing up and moving/removing the old volume data
- [x] I have tried running the stock `docker run` example(s) in the readme (removing any customizations I added)
- [x] I have tried a newer or older version of Docker Pi-hole (depending what version the issue started in for me) - **OLDER WORKS: `2024.01.0`**
- [x] I have tried running without my volume data mounts to eliminate volumes as the cause

**Comment by yubiuser** [comment]
How does you docker compose file looks like?
Please provide a debug token.

**Comment by aronmgv** [comment]
As I mention in the original post it is reproducible with docker-compose example: https://github.com/pi-hole/docker-pi-hole?tab=readme-ov-file#quick-start

Will provide debug token later..

**Comment by pepramon** [comment]
For me, its mandative add into environment

      FTLCONF_dns_listeningMode: 'all'

**Comment by zambrinf** [comment]
Take a look https://github.com/pi-hole/docker-pi-hole/issues/1695 happened the same to me

**Comment by aronmgv** [comment]
@pepramon @zambrinf thanks! it helped.
